{
  "catalog_id": "EG-DTF-BENCH-0.3",
  "score_threshold": 85,
  "rule": "All mandatory gates must pass. Performance and feature scores cannot compensate for a security, sovereignty, privacy or evidence gate failure.",
  "scenarios": [
    {"id": "ROOT-001", "family": "root-trust", "mandatory": true, "expected": "deny", "weight": 0, "test": "Attempt root operation without quorum.", "evidence": ["request", "participant-role-count", "decision"]},
    {"id": "ROOT-002", "family": "root-trust", "mandatory": true, "expected": "deny", "weight": 0, "test": "Attempt root key export.", "evidence": ["HSM policy", "export attempt", "decision"]},
    {"id": "SOV-001", "family": "sovereignty", "mandatory": true, "expected": "continue-local", "weight": 0, "test": "Remove every foreign management route.", "evidence": ["network isolation", "local decisions", "revocation result"]},
    {"id": "SOV-002", "family": "sovereignty", "mandatory": true, "expected": "deny", "weight": 0, "test": "Attempt standing vendor support access.", "evidence": ["account inventory", "gateway policy", "decision"]},
    {"id": "SOV-003", "family": "sovereignty", "mandatory": true, "expected": "complete", "weight": 0, "test": "Export and restore into a clean replacement environment.", "evidence": ["export digest", "restore log", "functional result"]},
    {"id": "IAM-001", "family": "human-identity", "mandatory": true, "expected": "deny", "weight": 0, "test": "Use expired employment authority.", "evidence": ["lifecycle event", "credential", "decision"]},
    {"id": "IAM-002", "family": "human-identity", "mandatory": true, "expected": "deny", "weight": 0, "test": "Use password-only authentication for a privileged role.", "evidence": ["authentication context", "role", "decision"]},
    {"id": "IAM-003", "family": "tenant-isolation", "mandatory": true, "expected": "deny", "weight": 0, "test": "Reuse identity across tenant boundary.", "evidence": ["principal tenant", "resource tenant", "decision"]},
    {"id": "PAM-001", "family": "privileged-access", "mandatory": true, "expected": "require-approval", "weight": 0, "test": "Request material privilege without required quorum.", "evidence": ["risk class", "approval policy", "decision"]},
    {"id": "PAM-002", "family": "privileged-access", "mandatory": true, "expected": "deny", "weight": 0, "test": "Reuse a just-in-time credential after expiry.", "evidence": ["credential id", "expiry", "decision"]},
    {"id": "PAM-003", "family": "privileged-access", "mandatory": true, "expected": "complete", "weight": 0, "test": "Reconstruct a privileged session from independent evidence.", "evidence": ["approval", "session digest", "command evidence", "result"]},
    {"id": "WRK-001", "family": "workload-identity", "mandatory": true, "expected": "deny", "weight": 0, "test": "Present workload identity outside the attested runtime.", "evidence": ["SVID", "attestation", "decision"]},
    {"id": "WRK-002", "family": "workload-identity", "mandatory": true, "expected": "deny", "weight": 0, "test": "Replay a workload credential after rotation.", "evidence": ["credential id", "rotation event", "decision"]},
    {"id": "AGT-001", "family": "agent-delegation", "mandatory": true, "expected": "deny", "weight": 0, "test": "Child agent requests authority outside parent scope.", "evidence": ["parent grant", "child request", "decision"]},
    {"id": "AGT-002", "family": "agent-purpose", "mandatory": true, "expected": "deny", "weight": 0, "test": "Reuse delegation for another business purpose.", "evidence": ["grant purpose", "request purpose", "decision"]},
    {"id": "AGT-003", "family": "agent-revocation", "mandatory": true, "expected": "deny", "weight": 0, "test": "Use descendant authority after parent revocation.", "evidence": ["revocation time", "lineage", "decision"]},
    {"id": "RAG-001", "family": "rag-authorization", "mandatory": true, "expected": "deny", "weight": 0, "test": "Retrieve a document outside source ACL.", "evidence": ["source ACL", "retrieval principal", "result"]},
    {"id": "RAG-002", "family": "rag-cache", "mandatory": true, "expected": "deny", "weight": 0, "test": "Recover restricted content from shared cache.", "evidence": ["cache key context", "principal", "result"]},
    {"id": "BIO-001", "family": "biometric-assertion", "mandatory": true, "expected": "deny", "weight": 0, "test": "Replay a biometric assertion.", "evidence": ["assertion id", "nonce", "expiry", "decision"]},
    {"id": "BIO-002", "family": "biometric-assertion", "mandatory": true, "expected": "deny", "weight": 0, "test": "Use an assertion for another reader or purpose.", "evidence": ["audience", "purpose", "device", "decision"]},
    {"id": "BIO-003", "family": "biometric-evaluation", "mandatory": true, "expected": "complete", "weight": 0, "test": "Produce stratified deployed-context error evaluation.", "evidence": ["protocol", "holdout digest", "stratified results", "limitations"]},
    {"id": "CAM-001", "family": "surveillance-edge", "mandatory": true, "expected": "deny", "weight": 0, "test": "Attempt direct camera Internet egress.", "evidence": ["network policy", "flow attempt", "decision"]},
    {"id": "CAM-002", "family": "surveillance-edge", "mandatory": true, "expected": "deny", "weight": 0, "test": "Attempt lateral movement from camera zone.", "evidence": ["segmentation policy", "connection attempt", "decision"]},
    {"id": "PHY-001", "family": "physical-ai", "mandatory": true, "expected": "deny", "weight": 0, "test": "Execute action with substituted model digest.", "evidence": ["approved digest", "observed digest", "decision"]},
    {"id": "PHY-002", "family": "physical-ai", "mandatory": true, "expected": "deny", "weight": 0, "test": "Replay an action lease against another request.", "evidence": ["lease", "request id", "decision"]},
    {"id": "EVD-001", "family": "evidence", "mandatory": true, "expected": "detect", "weight": 0, "test": "Alter or delete source-system evidence.", "evidence": ["source event", "independent digest", "verification"]},
    {"id": "SUP-001", "family": "supply-chain", "mandatory": true, "expected": "deny", "weight": 0, "test": "Admit an unsigned or digest-mismatched artifact.", "evidence": ["artifact", "signature", "digest", "decision"]},
    {"id": "REC-001", "family": "recovery", "mandatory": true, "expected": "complete", "weight": 0, "test": "Perform clean-room identity and policy recovery.", "evidence": ["backup digest", "restore log", "RTO", "RPO", "functional tests"]},
    {"id": "PERF-001", "family": "performance", "mandatory": false, "expected": "measure", "weight": 40, "test": "Measure authorization decision latency at defined load.", "evidence": ["environment", "load profile", "p50", "p95", "p99"]},
    {"id": "RES-001", "family": "resilience", "mandatory": false, "expected": "measure", "weight": 30, "test": "Measure recovery and failover under node loss.", "evidence": ["fault injection", "availability", "recovery time"]},
    {"id": "INT-001", "family": "interoperability", "mandatory": false, "expected": "measure", "weight": 20, "test": "Run portable protocol and export suite.", "evidence": ["protocol versions", "adapter versions", "pass rate"]},
    {"id": "OPS-001", "family": "operability", "mandatory": false, "expected": "measure", "weight": 10, "test": "Run no-vendor operations exercise.", "evidence": ["runbook", "task completion", "time", "exceptions"]}
  ]
}
